0/=LIVE ASSES, MULES AND HINNIES/=0%/=0101
0/=LIVE BOVINE ANIMALS/=0%/=0102
0/=LIVE SWINE/=0%/=0103
0/=LIVE SHEEP AND GOATS/=0%/=0104
0/=LIVE POULTRY, THAT IS TO SAY, FOWLS OF THE SPECIES GALLUS DOMESTICUS, DUCKS, GEESE, TURKEYS AND GUINEA FOWLS./=0%/=0105
0/=OTHER LIVE ANIMAL SUCH AS MAMMALS, BIRDS, INSECTS/=0%/=0106
0/=LIVE HORSES/=12%/=0101
0/=LIVE HORSES/=12%/=0101
0/=OTHER MEAT AND EDIBLE MEAT OFFAL, FROZEN AND PUT UP IN UNIT CONTAINERS AND PUT UP IN UNIT CONTAINER AND,- (A) BEARING A REGISTERED BRAND NAME; OR (B) BEARING A BRAND NAME ON WHICH AN ACTIONABLE CLAIM OR ENFORCEABLE RIGHT IN A COURT OF LAW IS AVAILABLE [OTHER THAN THOSE WHERE ANY ACTIONABLE CLAIM OR ENFORCEABLE RIGHT IN RESPECT OF SUCH BRAND NAME HAS BEEN FOREGONE VOLUNTARILY], SUBJECT TO THE CONDITIONS AS IN THE ANNEXURE]/=5%/=0208
0/=MEAT OF HORSES, ASSES, MULES OR HINNIES, FROZEN AND PUT UP IN UNIT CONTAINERS/=12%/=0205
0/=MEAT OF HORSES, ASSES, MULES OR HINNIES, FRESH, CHILLED OR FROZEN [OTHER THAN FROZEN AND PUT UP IN UNIT CONTAINER]/=0%/=0205
0/=MEAT OF BOVINE ANIMALS, FRESH AND CHILLED./=0%/=0201
0/=MEAT OF BOVINE ANIMALS, FROZEN AND PUT UP IN UNIT CONTAINERS/=12%/=0202
0/=MEAT OF BOVINE ANIMALS [OTHER THAN FRESH OR CHILLED] AND PUT UP IN UNIT CONTAINER AND,- (A) BEARING A REGISTERED BRAND NAME; OR (B) BEARING A BRAND NAME ON WHICH AN ACTIONABLE CLAIM OR ENFORCEABLE RIGHT IN A COURT OF LAW IS AVAILABLE [OTHER THAN THOSE WHERE ANY ACTIONABLE CLAIM OR ENFORCEABLE RIGHT IN RESPECT OF SUCH BRAND NAME HAS BEEN FOREGONE VOLUNTARILY], SUBJECT TO THE CONDITIONS AS IN THE ANNEXURE]/=5%/=0202
0/=MEAT OF BOVINE ANIMALS [OTHER THAN FROZEN AND PUT UP IN UNIT CONTAINER]/=0%/=0202
0/=MEAT OF SWINE, FROZEN AND PUT UP IN UNIT CONTAINERS/=12%/=0203
0/=MEAT OF SWINE [OTHER THAN FRESH OR CHILLED] AND PUT UP IN UNIT CONTAINER AND,- (A) BEARING A REGISTERED BRAND NAME; OR (B) BEARING A BRAND NAME ON WHICH AN ACTIONABLE CLAIM OR ENFORCEABLE RIGHT IN A COURT OF LAW IS AVAILABLE [OTHER THAN THOSE WHERE ANY ACTIONABLE CLAIM OR ENFORCEABLE RIGHT IN RESPECT OF SUCH BRAND NAME HAS BEEN FOREGONE VOLUNTARILY], SUBJECT TO THE CONDITIONS AS IN THE ANNEXURE]/=5%/=0203
0/=MEAT OF SWINE, FRESH, CHILLED OR FROZEN [OTHER THAN FROZEN AND PUT UP IN UNIT CONTAINER]/=0%/=0203
0/=MEAT OF SHEEP OR GOATS, FROZEN AND PUT UP IN UNIT CONTAINERS/=12%/=0204
0/=MEAT OF SHEEP OR GOATS [OTHER THAN FRESH OR CHILLED] AND PUT UP IN UNIT CONTAINER AND,- (A) BEARING A REGISTERED BRAND NAME; OR (B) BEARING A BRAND NAME ON WHICH AN ACTIONABLE CLAIM OR ENFORCEABLE RIGHT IN A COURT OF LAW IS AVAILABLE [OTHER THAN THOSE WHERE ANY ACTIONABLE CLAIM OR ENFORCEABLE RIGHT IN RESPECT OF SUCH BRAND NAME HAS BEEN FOREGONE VOLUNTARILY], SUBJECT TO THE CONDITIONS AS IN THE ANNEXURE]/=5%/=0204
0/=MEAT OF SHEEP OR GOATS, FRESH, CHILLED OR FROZEN [OTHER THAN FROZEN AND PUT UP IN UNIT CONTAINER]/=0%/=0204
0/=EDIBLE OFFAL OF BOVINE ANIMALS, SWINE, SHEEP, GOATS, HORSES, ASSES, MULES OR HINNIES, FROZEN AND PUT UP IN UNIT CONTAINERS/=12%/=0206
0/=EDIBLE OFFAL OF BOVINE ANIMALS, SWINE, SHEEP, GOATS, HORSES, ASSES, MULES OR HINNIES [OTHER THAN FRESH OR CHILLED] AND PUT UP IN UNIT CONTAINER AND,- (A) BEARING A REGISTERED BRAND NAME; OR (B) BEARING A BRAND NAME ON WHICH AN ACTIONABLE CLAIM OR ENFORCEABLE RIGHT IN A COURT OF LAW IS AVAILABLE [OTHER THAN THOSE WHERE ANY ACTIONABLE CLAIM OR ENFORCEABLE RIGHT IN RESPECT OF SUCH BRAND NAME HAS BEEN FOREGONE VOLUNTARILY], SUBJECT TO THE CONDITIONS AS IN THE ANNEXURE]/=5%/=0206
0/=EDIBLE OFFAL OF BOVINE ANIMALS, SWINE, SHEEP, GOATS, HORSES, ASSES, MULES OR HINNIES, FRESH, CHILLED OR FROZEN [OTHER THAN FROZEN AND PUT UP IN UNIT CONTAINER]/=0%/=0206
0/=MEAT AND EDIBLE OFFAL, OF THE POULTRY OF HEADING 0105, FROZEN AND PUT UP IN UNIT CONTAINERS/=12%/=0207
0/=MEAT AND EDIBLE OFFAL, OF THE POULTRY OF HEADING 0105[OTHER THAN FRESH OR CHILLED] AND PUT UP IN UNIT CONTAINER AND,- (A) BEARING A REGISTERED BRAND NAME; OR (B) BEARING A BRAND NAME ON WHICH AN ACTIONABLE CLAIM OR ENFORCEABLE RIGHT IN A COURT OF LAW IS AVAILABLE [OTHER THAN THOSE WHERE ANY ACTIONABLE CLAIM OR ENFORCEABLE RIGHT IN RESPECT OF SUCH BRAND NAME HAS BEEN FOREGONE VOLUNTARILY], SUBJECT TO THE CONDITIONS AS IN THE ANNEXURE]/=5%/=0207
0/=MEAT AND EDIBLE OFFAL, OF THE POULTRY OF HEADING 0105, FRESH, CHILLED OR FROZEN [OTHER THAN FROZEN AND PUT UP IN UNIT CONTAINER]/=0%/=0207
0/=OTHER MEAT AND EDIBLE MEAT OFFAL, FROZEN AND PUT UP IN UNIT CONTAINERS/=12%/=0208
0/=OTHER MEAT AND EDIBLE MEAT OFFAL, FRESH, CHILLED OR FROZEN [OTHER THAN FROZEN AND PUT UP IN UNIT CONTAINER]/=0%/=0208
0/=PIG FAT, FREE OF LEAN MEAT, AND POULTRY FAT, NOT RENDERED OR OTHERWISE EXTRACTED, FROZEN AND PUT UP IN UNIT CONTAINERS/=12%/=0209
0/=PIG FAT, FREE OF LEAN MEAT, AND POULTRY FAT, NOT RENDERED OR OTHERWISE EXTRACTED, SALTED, IN BRINE, DRIED OR SMOKED, PUT UP IN UNIT CONTAINERS/=12%/=0209
0/=PIG FAT, FREE OF LEAN MEAT, AND POULTRY FAT, NOT RENDERED OR OTHERWISE EXTRACTED, FRESH, CHILLED OR FROZEN [OTHER THAN FROZEN AND PUT UP IN UNIT CONTAINER]/=0%/=0209
0/=PIG FAT, FREE OF LEAN MEAT, AND POULTRY FAT AND PUT UP IN UNIT CONTAINERS AND PUT UP IN UNIT CONTAINER AND,-(A) BEARING A REGISTERED BRAND NAME; OR(B) BEARING A BRAND NAME ON WHICH AN ACTIONABLE CLAIM OR ENFORCEABLE RIGHT IN A COURT OF LAW IS AVAILABLE [OTHER THAN THOSE WHERE ANY ACTIONABLE CLAIM OR ENFORCEABLE RIGHT IN RESPECT OF SUCH BRAND NAME HAS BEEN FOREGONE VOLUNTARILY], SUBJECT TO THE CONDITIONS AS IN THE ANNEXURE]/=5%/=0209
0/=MEAT AND EDIBLE MEAT OFFAL, SALTED, IN BRINE, DRIED OR SMOKED PUT UP IN UNIT CONTAINERS; EDIBLE FLOURS AND MEALS OF MEAT OR MEAT OFFAL PUT UP IN UNIT CONTAINERS/=5%/=0210
0/=MEAT AND EDIBLE MEAT OFFAL, SALTED, IN BRINE, DRIED OR SMOKED; EDIBLE FLOURS AND MEALS OF MEAT OR MEAT OFFAL, OTHER THAN PUT UP IN UNIT CONTAINERS/=0%/=0211
0/=LIVE FISH./=0%/=0301
0/=FISH, FRESH OR CHILLED, EXCLUDING FISH FILLETS AND OTHER FISH MEAT OF HEADING 0304/=0%/=0302
0/=FISH, FROZEN, EXCLUDING FISH FILLETS AND OTHER FISH MEAT OF HEADING 0304 ( INSERTED W.E.F 14/11/2017 : AND PUT UP IN UNIT CONTAINER AND,- (A) BEARING A REGISTERED BRAND NAME; OR (B) BEARING A BRAND NAME ON WHICH AN ACTIONABLE CLAIM OR ENFORCEABLE RIGHT IN A COURT OF LAW IS AVAILABLE [OTHER THAN THOSE WHERE ANY ACTIONABLE CLAIM OR ENFORCEABLE RIGHT IN RESPECT OF SUCH BRAND NAME HAS BEEN FOREGONE VOLUNTARILY], SUBJECT TO THE CONDITIONS AS IN THE ANNEXURE]/=0%/=0303
0/=FISH FILLETS AND OTHER FISH MEAT (WHETHER OR NOT MINCED), FROZEN ( INSERTED W.E.F 14/11/2017: AND PUT UP IN UNIT CONTAINER AND,- (A) BEARING A REGISTERED BRAND NAME; OR (B) BEARING A BRAND NAME ON WHICH AN ACTIONABLE CLAIM OR ENFORCEABLE RIGHT IN A COURT OF LAW IS AVAILABLE [OTHER THAN THOSE WHERE ANY ACTIONABLE CLAIM OR ENFORCEABLE RIGHT IN RESPECT OF SUCH BRAND NAME HAS BEEN FOREGONE VOLUNTARILY], SUBJECT TO THE CONDITIONS AS IN THE ANNEXURE]/=5%/=0304
0/=FISH FILLETS AND OTHER FISH MEAT (WHETHER OR NOT MINCED), FRESH OR CHILLED./=0%/=0304
0/=FISH, DRIED, SALTED OR IN BRINE; SMOKED FISH, WHETHER OR NOT COOKED BEFORE OR DURING THE SMOKING PROCESS; FLOURS, MEALS AND PELLETS OF FISH, FIT FOR HUMAN CONSUMPTION (INSERTED W.E.F 14/11/2017 : AND PUT UP IN UNIT CONTAINER AND,- (A) BEARING A REGISTERED BRAND NAME; OR (B) BEARING A BRAND NAME ON WHICH AN ACTIONABLE CLAIM OR ENFORCEABLE RIGHT IN A COURT OF LAW IS AVAILABLE [OTHER THAN THOSE WHERE ANY ACTIONABLE CLAIM OR ENFORCEABLE RIGHT IN RESPECT OF SUCH BRAND NAME HAS BEEN FOREGONE VOLUNTARILY], SUBJECT TO THE CONDITIONS AS IN THE ANNEXURE/=5%/=0305
0/=FISH DRIED (NOT PUT UP IN UNIT CONTAINER BEARING A BRAND NAME)/=0%/=0305
0/=CRUSTACEANS, WHETHER IN SHELL OR NOT, FROZEN, DRIED, SALTED OR IN BRINE; CRUSTACEANS, IN SHELL, COOKED BY STEAMING OR BY BOILING IN WATER, FROZEN, DRIED, SALTED OR IN BRINE; FLOURS, MEALS AND PELLETS OF CRUSTACEANS, FIT FOR HUMAN CONSUMPTION (INSERTED W.E.F 14/11/2017 : AND PUT UP IN UNIT CONTAINER AND,- (A) BEARING A REGISTERED BRAND NAME; OR (B) BEARING A BRAND NAME ON WHICH AN ACTIONABLE CLAIM OR ENFORCEABLE RIGHT IN A COURT OF LAW IS AVAILABLE [OTHER THAN THOSE WHERE ANY ACTIONABLE CLAIM OR ENFORCEABLE RIGHT IN RESPECT OF SUCH BRAND NAME HAS BEEN FOREGONE VOLUNTARILY], SUBJECT TO THE CONDITIONS AS IN THE ANNEXURE]/=5%/=0306
0/=CRUSTACEANS, WHETHER IN SHELL OR NOT, LIVE, FRESH OR CHILLED; CRUSTACEANS, IN SHELL, COOKED BY STEAMING OR BY BOILING IN WATER LIVE, FRESH OR CHILLED./=0%/=0306
0/=MOLLUSCS, WHETHER IN SHELL OR NOT, FROZEN, DRIED, SALTED OR IN BRINE; AQUATIC INVERTEBRATES OTHER THAN CRUSTACEANS AND MOLLUSCS, FROZEN, DRIED, SALTED OR IN BRINE; FLOURS, MEALS AND PELLETS OF AQUATIC INVERTEBRA OTHER THAN CRUSTACEANS, FIT FOR HUMAN CONSUMPTION (INSERTED W.E.F 14/11/2017 : AND PUT UP IN UNIT CONTAINER AND,- (A) BEARING A REGISTERED BRAND NAME; OR (B) BEARING A BRAND NAME ON WHICH AN ACTIONABLE CLAIM OR ENFORCEABLE RIGHT IN A COURT OF LAW IS AVAILABLE [OTHER THAN THOSE WHERE ANY ACTIONABLE CLAIM OR ENFORCEABLE RIGHT IN RESPECT OF SUCH BRAND NAME HAS BEEN FOREGONE VOLUNTARILY], SUBJECT TO THE CONDITIONS AS IN THE ANNEXURE]/=5%/=0307
0/=MOLLUSCS, WHETHER IN SHELL OR NOT, LIVE, FRESH, CHILLED; AQUATIC INVERTEBRATES OTHER THAN CRUSTACEANS AND MOLLUSCS, LIVE, FRESH OR CHILLED./=0%/=0307
0/=AQUATIC INVERTEBRATES OTHER THAN CRUSTACEANS AND MOLLUSCS, FROZEN, DRIED, SALTED OR IN BRINE; SMOKED AQUATIC INVERTEBRATES OTHER THAN CRUSTACEANS AND MOLLUSCS, WHETHER OR NOT COOKED BEFORE OR DURING THE SMOKING PROCESS: FLOURS, MEALS AND PELLETS OF AQUATIC INVERTEBRATES OTHER THAN CRUSTACEANS AND MOLLUSCS, FIT FOR HUMAN CONSUMPTION (INSERTED W.E.F 14/11/2017 : AND PUT UP IN UNIT CONTAINER AND,- (A) BEARING A REGISTERED BRAND NAME; OR (B) BEARING A BRAND NAME ON WHICH AN ACTIONABLE CLAIM OR ENFORCEABLE RIGHT IN A COURT OF LAW IS AVAILABLE [OTHER THAN THOSE WHERE ANY ACTIONABLE CLAIM OR ENFORCEABLE RIGHT IN RESPECT OF SUCH BRAND NAME HAS BEEN FOREGONE VOLUNTARILY], SUBJECT TO THE CONDITIONS AS IN THE ANNEXURE]/=5%/=0308
0/=AQUATIC INVERTEBRATES OTHER THAN CRUSTACEANS AND MOLLUSCS, LIVE, FRESH OR CHILLED./=0%/=0308
0/=FISH SEEDS, PRAWN / SHRIMP SEEDS WHETHER OR NOT PROCESSED, CURED OR IN FROZEN STATE [OTHER THAN GOODS FALLING UNDER CHAPTER 3 AND ATTRACTING 5%]/=0%/=03
0/=NATURAL HONEY, PUT UP IN UNIT CONTAINER AND BEARING A REGISTERED BRAND NAME/=5%/=0409
0/=NATURAL HONEY, OTHER THAN PUT UP IN UNIT CONTAINER AND BEARING A REGISTERED BRAND NAME/=0%/=0409
0/=ULTRA HIGH TEMPERATURE (UHT) MILK/=5%/=0401
0/=FRESH MILK AND PASTEURISED MILK, INCLUDING SEPARATED MILK, MILK AND CREAM, NOT CONCENTRATED NOR CONTAINING ADDED SUGAR OR OTHER SWEETENING MATTER, EXCLUDING ULTRA HIGH TEMPERATURE (UHT) MILK/=0%/=0401
0/=MILK AND CREAM, CONCENTRATED OR CONTAINING ADDED SUGAR OR OTHER SWEETENING MATTER, INCLUDING SKIMMED MILK POWDER, MILK FOOD FOR BABIES [OTHER THAN CONDENSED MILK]/=5%/=0402
0/=CREAM, YOGURT, KEPHIR AND OTHER FERMENTED OR ACIDIFIED MILK AND CREAM, WHETHER OR NOT CONCENTRATED OR CONTAINING ADDED SUGAR OR OTHER SWEETENING MATTER OR FLAVOURED OR CONTAINING ADDED FRUIT, NUTS OR COCOA/=5%/=0403
0/=CURD; LASSI; BUTTER MILK/=0%/=0403
0/=WHEY, WHETHER OR NOT CONCENTRATED OR CONTAINING ADDED SUGAR OR OTHER SWEETENING MATTER; PRODUCTS CONSISTING OF NATURAL MILK CONSTITUENTS, WHETHER OR NOT CONTAINING ADDED SUGAR OR OTHER SWEETENING MATTER, NOT ELSEWHERE SPECIFIED OR INCLUDED/=5%/=0404
0/=BUTTER AND OTHER FATS (I.E. GHEE, BUTTER OIL, ETC.) AND OILS DERIVED FROM MILK; DAIRY SPREADS/=12%/=0405
0/=CHENA OR PANEER PUT UP IN UNIT CONTAINER AND BEARING A REGISTERED BRAND NAME/=5%/=0406
0/=CHEESE/=12%/=0406
0/=CHENA OR PANEER, OTHER THAN PUT UP IN UNIT CONTAINERS AND BEARING A REGISTERED BRAND NAME;/=0%/=0406
0/=BIRDS' EGGS, IN SHELL, FRESH, PRESERVED OR COOKED/=0%/=0407
0/=BIRDS' EGGS, NOT IN SHELL, AND EGG YOLKS, FRESH, DRIED, COOKED BY STEAMING OR BY BOILING IN WATER, MOULDED, FROZEN OR OTHERWISE PRESERVED, WHETHER OR NOT CONTAINING ADDED SUGAR OR OTHER SWEET- ENING MATTER./=5%/=0408
0/=EDIBLE PRODUCTS OF ANIMAL ORIGIN, NOT ELSEWHERE SPECIFIED OR INCLUDED/=5%/=0410
0/=CONDENSED MILK/=12%/=0402
0/=CONDENSED MILK/=12%/=0402
0/=HUMAN HAIR, UNWORKED, WHETHER OR NOT WASHED OR SCOURED; WASTE OF HUMAN HAIR/=0%/=0501
0/=PIGS', HOGS' OR BOARS' BRISTLES AND HAIR; BADGER HAIR AND OTHER BRUSH MAKING HAIR; WASTE OF SUCH BRISTLES OR HAIR./=5%/=0502
0/=GUTS, BLADDERS AND STOMACHS OF ANIMALS (OTHER THAN FISH), WHOLE AND PIECES THEREOF, FRESH, CHILLED, FROZEN, SALTED, IN BRINE, DRIED OR SMOKED (INSERTED W.E.F 14/11/2017 : AND PUT UP IN UNIT CONTAINER AND,- (A) BEARING A REGISTERED BRAND NAME; OR (B) BEARING A BRAND NAME ON WHICH AN ACTIONABLE CLAIM OR ENFORCEABLE RIGHT IN A COURT OF LAW IS AVAILABLE [OTHER THAN THOSE WHERE ANY ACTIONABLE CLAIM OR ENFORCEABLE RIGHT IN RESPECT OF SUCH BRAND NAME HAS BEEN FOREGONE VOLUNTARILY], SUBJECT TO THE CONDITIONS AS IN THE ANNEXURE]/=5%/=0504
0/=SKINS AND OTHER PARTS OF BIRDS, WITH THEIR FEATHERS OR DOWN, FEATHERS AND PARTS OF FEATHERS (WHETHER OR NOT WITH TRIMMED EDGES) AND DOWN, NOT FURTHER WORKED THAN CLEANED, DISINFECTED OR TREATED FOR PRESERVATION; POWDER AND WASTE OF FEATHERS OR PARTS OF FEATHERS/=5%/=0505
0/=ALL GOODS I.E. BONES AND HORN-CORES, UNWORKED, DEFATTED, SIMPLY PREPARED (BUT NOT CUT TO SHAPE), TREATED WITH ACID OR GELATINISED; POWDER AND WASTE OF THESE PRODUCTS/=0%/=0506
0/=IVORY, TORTOISE-SHELL, WHALEBONE AND WHALEBONE HAIR, HORNS, UNWORKED OR SIMPLY PREPARED BUT NOT CUT TO SHAPE; POWDER AND WASTE OF THESE PRODUCTS. [EXCEPT 050790]/=5%/=0507
0/=CORAL AND SIMILAR MATERIALS, UNWORKED OR SIMPLY PREPARED BUT NOT OTHERWISE WORKED; SHELLS OF MOLLUSCS, CRUSTACEANS OR ECHINODERMS AND CUTTLE-BONE, UNWORKED OR SIMPLY PREPARED BUT NOT CUT TO SHAPE, POWDER AND WASTE THEREOF./=5%/=0508
0/=AMBERGRIS, CASTOREUM, CIVET AND MUSK; CANTHARIDES; BILE, WHETHER OR NOT DRIED; GLANDS AND OTHER ANIMAL PRODUCTS USED IN THE PREPARATION OF PHARMACEUTICAL PRODUCTS, FRESH, CHILLED, FROZEN OR OTHERWISE PROVISIONALLY PRESERVED./=5%/=0510
0/=ANIMAL PRODUCTS NOT ELSEWHERE SPECIFIED OR INCLUDED; DEAD ANIMALS OF CHAPTER 1 OR 3, UNFIT FOR HUMAN CONSUMPTION, OTHER THAN SEMEN INCLUDING FROZEN SEMEN./=5%/=0511
0/=SEMEN INCLUDING FROZEN SEMEN/=0%/=0511
0/=ALL GOODS I.E. HOOF MEAL; HORN MEAL; HOOVES, CLAWS, NAILS AND BEAKS; ANTLERS; ETC./=0%/=0507
0/=LIVE TREES AND OTHER PLANTS; BULBS, ROOTS AND THE LIKE; CUT FLOWERS AND ORNAMENTAL FOLIAGE/=0%/=06
0/=TOMATOES, FRESH OR CHILLED./=0%/=0702
0/=CUCUMBERS AND GHERKINS, FRESH OR CHILLED./=0%/=0707
0/=POTATOES, FRESH OR CHILLED./=0%/=0701
0/=ONIONS, SHALLOTS, GARLIC, LEEKS AND OTHER ALLIACEOUS VEGETABLES, FRESH OR CHILLED./=0%/=0703
0/=CABBAGES, CAULIFLOWERS, KOHLRABI, KALE AND SIMILAR EDIBLE BRASSICAS, FRESH OR CHILLED./=0%/=0704
0/=LETTUCE (LACTUCA SATIVA) AND CHICORY (CICHORIUM SPP.), FRESH OR CHILLED./=0%/=0705
0/=CARROTS, TURNIPS, SALAD BEETROOT, SALSIFY, CELERIAC, RADISHES AND SIMILAR EDIBLE ROOTS, FRESH OR CHILLED./=0%/=0706
0/=LEGUMINOUS VEGETABLES, SHELLED OR UNSHELLED, FRESH OR CHILLED./=0%/=0708
0/=OTHER VEGETABLES, FRESH OR CHILLED./=0%/=0709
0/=VEGETABLES (UNCOOKED OR COOKED BY STEAMING OR BOILING IN WATER), FROZEN (INSERTED W.E.F 14/11/2017 : AND PUT UP IN UNIT CONTAINER AND,- (A) BEARING A REGISTERED BRAND NAME; OR (B) BEARING A BRAND NAME ON WHICH AN ACTIONABLE CLAIM OR ENFORCEABLE RIGHT IN A COURT OF LAW IS AVAILABLE [OTHER THAN THOSE WHERE ANY ACTIONABLE CLAIM OR ENFORCEABLE RIGHT IN RESPECT OF SUCH BRAND NAME HAS BEEN FOREGONE VOLUNTARILY], SUBJECT TO THE CONDITIONS AS IN THE ANNEXURE]/=5%/=0710
0/=VEGETABLES PROVISIONALLY PRESERVED (FOR EXAMPLE, BY SULPHUR DIOXIDE GAS, IN BRINE, IN SULPHUR WATER OR IN OTHER PRESERVATIVE SOLUTIONS), BUT UNSUITABLE IN THAT STATE FOR IMMEDIATE CONSUMPTION/=5%/=0711
0/=DRIED VEGETABLES, WHOLE, CUT, SLICED, BROKEN OR IN POWDER, BUT NOT FURTHER PREPARED./=0%/=0712
0/=DRIED LEGUMINOUS VEGETABLES, SHELLED, WHETHER OR NOT SKINNED OR SPLIT [PUT UP IN UNIT CONTAINER AND BEARING A REGISTERED BRAND NAME]/=5%/=0713
0/=DRIED LEGUMINOUS VEGETABLES, SHELLED, WHETHER OR NOT SKINNED OR SPLIT./=0%/=0713
0/=MANIOC, ARROWROOT, SALEP, JERUSALEM ARTICHOKES, SWEET POTATOES AND SIMILAR ROOTS AND TUBERS WITH HIGH STARCH OR INULIN CONTENT, FROZEN OR DRIED, WHETHER OR NOT SLICED OR IN THE FORM OF PELLETS (INSERTED W.E.F 14/11/2017 : AND PUT UP IN UNIT CONTAINER AND,- (A) BEARING A REGISTERED BRAND NAME; OR (B) BEARING A BRAND NAME ON WHICH AN ACTIONABLE CLAIM OR ENFORCEABLE RIGHT IN A COURT OF LAW IS AVAILABLE [OTHER THAN THOSE WHERE ANY ACTIONABLE CLAIM OR ENFORCEABLE RIGHT IN RESPECT OF SUCH BRAND NAME HAS BEEN FOREGONE VOLUNTARILY], SUBJECT TO THE CONDITIONS AS IN THE ANNEXURE]/=0%/=0714
0/=MANIOC, ARROWROOT, SALEP, JERUSALEM ARTICHOKES, SWEET POTATOES AND SIMILAR ROOTS AND TUBERS WITH HIGH STARCH OR INULIN CONTENT, FRESH OR CHILLED; SAGO PITH./=0%/=0714
0/=HERB, BARK, DRY PLANT, DRY ROOT, COMMONLY KNOWN AS JARIBOOTI AND DRY FLOWER/=5%/=07
0/=PEEL OF CITRUS FRUIT OR MELONS (INCLUDING WATERMELONS), FROZEN, DRIED OR PROVISIONALLY PRESERVED IN BRINE, IN SULPHUR WATER OR IN OTHER PRESERVATIVE SOLUTIONS/=5%/=0814
0/=PEEL OF CITRUS FRUIT OR MELONS (INCLUDING WATERMELONS), FRESH./=0%/=0814
0/=CASHEWNUTS, WHETHER OR NOT SHELLED OR PEELED, (INSERTED W.E.F 14/11/2017 : DESICCATED COCONUTS/=5%/=0801
0/=BRAZIL NUTS, DRIED, WHETHER OR NOT SHELLED OR PEELED/=12%/=0801
0/=COCONUTS, FRESH OR DRIED, WHETHER OR NOT SHELLED OR PEELED/=0%/=0801
0/=BRAZIL NUTS, FRESH, WHETHER OR NOT SHELLED OR PEELED/=0%/=0801
0/=DRIED ARECA NUTS, WHETHER OR NOT SHELLED OR PEELED/=5%/=0802
0/=DRIED CHESTNUTS (SINGHADA), WHETHER OR NOT SHELLED OR PEELED/=5%/=0802
0/=OTHER NUTS, DRIED, WHETHER OR NOT SHELLED OR PEELED, SUCH AS ALMONDS, HAZEL NUTS OR FILBERTS (CORYIUS SPP.), CHESTNUTS (CASTANEA SPP.), PISTACHIOS, MACADAMIA NUTS, KOLA NUTS (COLA SPP.) [OTHER THAN DRIED ARECA NUTS]/=12%/=0802
0/=OTHER NUTS, OTHER NUTS, FRESH SUCH AS ALMONDS, HAZELNUTS OR FILBERTS (CORYIUS SPP.), WALNUTS, CHESTNUTS (CASTANEA SPP.), PISTACHIOS, MACADAMIA NUTS, KOLA NUTS (COLA SPP.), ARECA NUTS, FRESH, WHETHER OR NOT SHELLED OR PEELED/=0%/=0802
0/=WALNUTS, WHETHER OR NOT SHELLED/=5%/=0802
0/=BANANAS, INCLUDING PLANTAINS, FRESH OR DRIED/=0%/=0803
0/=MANGOES SLICED, DRIED/=5%/=0804
0/=DATES (SOFT OR HARD), FIGS, PINEAPPLES, AVOCADOS, GUAVAS, AND MANGOSTEENS, DRIED/=12%/=0804
0/=DATES, FIGS, PINEAPPLES, AVOCADOS, GUAVAS, MANGOES AND MANGOSTEENS, FRESH./=0%/=0804
0/=CITRUS FRUIT, SUCH AS ORANGES, MANDARINS (INCLUDING TANGERINES AND SATSUMAS); CLEMENTINES, WILKINGS AND SIMILAR CITRUS HYBRIDS, GRAPEFRUIT, INCLUDING POMELOS, LEMONS (CITRUS LIMON, CITRUS LIMONUM) AND LIMES (CITRUS AURANTIFOLIA, CITRUS LATIFOLIA), FRESH./=0%/=0805
0/=GRAPES, DRIED, AND RAISINS/=5%/=0806
0/=GRAPES, FRESH/=0%/=0806
0/=MELONS (INCLUDING WATERMELONS) AND PAPAWS (PAPAYAS), FRESH./=0%/=0807
0/=APPLES, PEARS AND QUINCES, FRESH./=0%/=0808
0/=APRICOTS, CHERRIES, PEACHES (INCLUDING NECTARINES), PLUMS AND SLOES, FRESH./=0%/=0809
0/=OTHER FRUIT SUCH AS STRAWBERRIES, RASPBERRIES, BLACKBERRIES, MULBERRIES AND LOGANBERRIES, BLACK, WHITE OR RED CURRANTS AND GOOSEBERRIES, CRANBERRIES, BILBERRIES AND OTHER FRUITS OF THE GENUS VACCINIUM, KIWI FRUIT, DURIANS, PERSIMMONS, POMEGRANATES, TAMARIND, SAPOTA (CHICO), CUSTARD-APPLE (ATA), BORE, LICHI, FRESH./=0%/=0810
0/=FRUIT AND NUTS, UNCOOKED OR COOKED BY STEAMING OR BOILING IN WATER, FROZEN, WHETHER OR NOT CONTAINING ADDED SUGAR OR OTHER SWEETENING MATTER/=5%/=0811
0/=FRUIT AND NUTS, PROVISIONALLY PRESERVED (FOR EXAMPLE, BY SULPHUR DIOXIDE GAS, IN BRINE, IN SULPHUR WATER OR IN OTHER PRESERVATIVE SOLUTIONS), BUT UNSUITABLE IN THAT STATE FOR IMMEDIATE CONSUMPTION/=5%/=0812
0/=TAMARIND, DRIED/=5%/=0813
0/=FRUIT, DRIED, OTHER THAN THAT OF HEADINGS 0801 TO 0806; MIXTURES OF NUTS OR DRIED FRUITS OF CHAPTER 8 [OTHER THAN DRIED TAMARIND AND DRIED CHESTNUT(SINGHADA) WHETHER OR NOT SHELLED OR PELLED]/=12%/=0813
0/=DRIED MAKHANA, WHETHER OR NOT SHELLED OR PEELED (INSERTED W.E.F : 14/11/2017 : PUT UP IN UNIT CONTAINER AND,- (A) BEARING A REGISTERED BRAND NAME; OR (B) BEARING A BRAND NAME ON WHICH AN ACTIONABLE CLAIM OR ENFORCEABLE RIGHT IN A COURT OF LAW IS AVAILABLE [OTHER THAN THOSE WHERE ANY ACTIONABLE CLAIM OR ENFORCEABLE RIGHT IN RESPECT OF SUCH BRAND NAME HAS BEEN FOREGONE VOLUNTARILY], SUBJECT TO THE CONDITIONS AS IN THE ANNEXURE/=5%/=08
0/=MATÉ/=5%/=0903
0/=COFFEE, WHETHER OR NOT ROASTED OR DECAFFEINATED; COFFEE HUSKS AND SKINS; COFFEE SUBSTITUTES CONTAINING COFFEE IN ANY PROPORTION [OTHER THAN COFFEE BEANS NOT ROASTED]/=5%/=0901
0/=COFFEE BEANS, NOT ROASTED/=0%/=0901
0/=TEA, WHETHER OR NOT FLAVOURED [OTHER THAN UNPROCESSED GREEN LEAVES OF TEA]/=5%/=0902
0/=UNPROCESSED GREEN LEAVES OF TEA/=0%/=0902
0/=PEPPER OF THE GENUS PIPER; DRIED OR CRUSHED OR GROUND FRUITS OF THE GENUS CAPSICUM OR OF THE GENUS PIMENTA/=5%/=0904
0/=VANILLA/=5%/=0905
0/=CINNAMON AND CINNAMON-TREE FLOWERS/=5%/=0906
0/=CLOVES (WHOLE FRUIT, CLOVES AND STEMS)/=5%/=0907
0/=NUTMEG, MACE AND CARDAMOMS/=5%/=0908
0/=SEEDS OF ANISE, BADIAN, FENNEL, CORIANDER, CUMIN OR CARAWAY; JUNIPER BERRIES [OTHER THAN OF SEED QUALITY]/=5%/=0909
0/=SEEDS OF ANISE, BADIAN, FENNEL, CORIANDER, CUMIN OR CARAWAY; JUNIPER BERRIES [OF SEED QUALITY]/=0%/=0909
0/=GINGER OTHER THAN FRESH GINGER, SAFFRON, TURMERIC (CURCUMA) OTHER THAN FRESH TURMERIC, THYME, BAY LEAVES, CURRY AND OTHER SPICES[OTHER THAN 09101110, 09103010]/=5%/=0910
0/=FRESH TURMERIC, OTHER THAN IN PROCESSED FORM/=0%/=0910
0/=FRESH GINGER, OTHER THAN IN PROCESSED FORM/=0%/=0910
0/=ALL GOODS OF SEED QUALITY/=0%/=09
0/=WHEAT AND MESLIN [OTHER THAN THOSE PUT UP IN UNIT CONTAINER AND BEARING A REGISTERED BRAND NAME]/=0%/=01001
0/=WHEAT AND MESLIN PUT UP IN UNIT CONTAINER AND BEARING A REGISTERED BRAND NAME/=5%/=01001
0/=RYE [OTHER THAN THOSE PUT UP IN UNIT CONTAINER AND BEARING A REGISTERED BRAND NAME]/=0%/=01002
0/=RYE PUT UP IN UNIT CONTAINER AND BEARING A REGISTERED BRAND NAME/=5%/=01002
0/=BARLEY [OTHER THAN THOSE PUT UP IN UNIT CONTAINER AND BEARING A REGISTERED BRAND NAME]/=0%/=01003
0/=BARLEY PUT UP IN UNIT CONTAINER AND BEARING A REGISTERED BRAND NAME/=5%/=01003
0/=OATS [OTHER THAN THOSE PUT UP IN UNIT CONTAINER AND BEARING A REGISTERED BRAND NAME]/=0%/=01004
0/=OATS PUT UP IN UNIT CONTAINER AND BEARING A REGISTERED BRAND NAME/=5%/=01004
0/=MAIZE (CORN) [OTHER THAN THOSE PUT UP IN UNIT CONTAINER AND BEARING A REGISTERED BRAND NAME]/=0%/=01005
0/=MAIZE (CORN) PUT UP IN UNIT CONTAINER AND BEARING A REGISTERED BRAND NAME/=5%/=01005
0/=RICE [OTHER THAN THOSE PUT UP IN UNIT CONTAINER AND BEARING A REGISTERED BRAND NAME]/=0%/=01006
0/=RICE PUT UP IN UNIT CONTAINER AND BEARING A REGISTERED BRAND NAME/=5%/=01006
0/=GRAIN SORGHUM [OTHER THAN THOSE PUT UP IN UNIT CONTAINER AND BEARING A REGISTERED BRAND NAME]/=0%/=01007
0/=GRAIN SORGHUM PUT UP IN UNIT CONTAINER AND BEARING A REGISTERED BRAND NAME/=5%/=01007
0/=BUCKWHEAT, MILLET AND CANARY SEED; OTHER CEREALS SUCH AS JAWAR, BAJRA, RAGI] [OTHER THAN THOSE PUT UP IN UNIT CONTAINER AND BEARING A REGISTERED BRAND NAME]/=0%/=01008
0/=BUCKWHEAT, MILLET AND CANARY SEED; OTHER CEREALS SUCH AS JAWAR, BAJRA, RAGI] PUT UP IN UNIT CONTAINER AND BEARING A REGISTERED BRAND NAME/=5%/=01008
0/=ALL GOODS I.E. CEREALS, PUT UP IN UNIT CONTAINER AND BEARING A REGISTERED BRAND NAME/=5%/=010
0/=WHEAT OR MESLIN FLOUR [OTHER THAN THOSE PUT UP IN UNIT CONTAINER AND BEARING A REGISTERED BRAND NAME]./=0%/=1101
0/=WHEAT OR MESLIN FLOUR PUT UP IN UNIT CONTAINER AND BEARING A REGISTERED BRAND NAME./=5%/=1101
0/=CEREAL FLOURS OTHER THAN OF WHEAT OR MESLIN, [MAIZE (CORN) FLOUR, RYE FLOUR, ETC.] [OTHER THAN THOSE PUT UP IN UNIT CONTAINER AND BEARING A REGISTERED BRAND NAME]/=0%/=1102
0/=CEREAL FLOURS OTHER THAN OF WHEAT OR MESLIN I.E. MAIZE (CORN) FLOUR, RYE FLOUR, ETC. PUT UP IN UNIT CONTAINER AND BEARING A REGISTERED BRAND NAME/=5%/=1102
0/=CEREAL GROATS, MEAL AND PELLETS [OTHER THAN THOSE PUT UP IN UNIT CONTAINER AND BEARING A REGISTERED BRAND NAME]/=0%/=1103
0/=CEREAL GROATS, MEAL AND PELLETS, INCLUDING SUJI AND DALIA, PUT UP IN UNIT CONTAINER AND BEARING A REGISTERED BRAND NAME/=5%/=1103
0/=CEREAL GRAINS HULLED/=0%/=1104
0/=CEREAL GRAINS OTHERWISE WORKED (FOR EXAMPLE, ROLLED, FLAKED, PEARLED, SLICED OR KIBBLED), EXCEPT RICE OF HEADING 1006; GERM OF CEREALS, WHOLE, ROLLED, FLAKED OR GROUND [OTHER THAN HULLED CEREAL GRAINS]/=5%/=1104
0/=FLOUR, OF POTATOES [OTHER THAN THOSE PUT UP IN UNIT CONTAINER AND BEARING A REGISTERED BRAND NAME DELETED W.E.F 10/11/2017 ]/=0%/=1105
0/=MEAL, POWDER,FLOUR, FLAKES, GRANULES AND PELLETS OF POTATOES PUT UP IN UNIT CONTAINER AND BEARING A REGISTERED BRAND NAME/=5%/=1105
0/=FLOUR, OF THE DRIED LEGUMINOUS VEGETABLES OF HEADING 0713 (PULSES) [OTHER THAN GUAR MEAL 1106 10 10 AND GUAR GUM REFINED SPLIT 1106 10 90], OF SAGO OR OF ROOTS OR TUBERS OF HEADING 0714 OR OF THE PRODUCTS OF CHAPTER 8 I.E. OF TAMARIND, OF SINGODA, MANGO FLOUR, ETC. [OTHER THAN THOSE PUT UP IN UNIT CONTAINER AND BEARING A REGISTERED BRAND NAME]/=0%/=1106
0/=MEAL AND POWDER OF THE DRIED LEGUMINOUS VEGETABLES OF HEADING 0713 (PULSES) [OTHER THAN GUAR MEAL 1106 10 10 AND GUAR GUM REFINED SPLIT 1106 10 90], OF SAGO OR OF ROOTS OR TUBERS OF HEADING 0714 OR OF THE PRODUCTS OF CHAPTER 8, PUT UP IN UNIT CONTAINER AND BEARING A REGISTERED BRAND NAME/=5%/=1106
0/=MALT, WHETHER OR NOT ROASTED/=18%/=1107
0/=STARCHES; INULIN/=12%/=1108
0/=WHEAT GLUTEN, WHETHER OR NOT DRIED/=5%/=1109
0/=GUAR GUM REFINED SPLIT/=5%/=1106
0/=GUAR MEAL/=0%/=1106
0/=COPRA ( DELETED W.E.F 14/11/2017 : OTHER THAN OF SEED QUALITY)/=5%/=1203
0/=CEREAL STRAW AND HUSKS, UNPREPARED, WHETHER OR NOT CHOPPED, GROUND, PRESSED OR IN THE FORM OF PELLETS/=0%/=1213
0/=SOYA BEANS, WHETHER OR NOT BROKEN, OF SEED QUALITY./=0%/=1201
0/=SOYA BEANS, WHETHER OR NOT BROKEN OTHER THAN OF SEED QUALITY./=5%/=1201
0/=GROUND-NUTS, NOT ROASTED OR OTHERWISE COOKED, WHETHER OR NOT SHELLED OR BROKEN, OF SEED QUALITY./=0%/=1202
0/=GROUND-NUTS, NOT ROASTED OR OTHERWISE COOKED, WHETHER OR NOT SHELLED OR BROKEN OTHER THAN OF SEED QUALITY./=5%/=1202
0/=LINSEED, WHETHER OR NOT BROKEN, OF SEED QUALITY./=0%/=1204
