0/=MACHINERY FOR CLEANING OR DRYING BOTTLES OR OTHER CONTAINERS; MACHINERY FOR FILLING, CLOSING, SEALING OR LABELLING BOTTLES, CANS, BOXES, BAGS OR OTHER CONTAINERS; MACHINERY FOR CAPSULING BOTTLES, JARS, TUBES AND SIMILAR CONTAINERS; OTHER PACKING OR WRAPPING MACHINERY (INCLUDING HEAT-SHRINK WRAPPING MACHINERY); MACHINERY FOR AERATING BEVERAGES [OTHER THAN DISH WASHING MACHINES] [OTHER THAN 84221100, 84221900]/=18%/=8522
0/=E-WASTE EXPLANATION: FOR THE PURPOSE OF THIS ENTRY, E-WASTE MEANSELECTRICAL AND ELECTRONIC EQUIPMENT LISTED IN SCHEDULE I OF THE EWASTE (MANAGEMENT) RULES, 2016, PUBLISHED IN THE GAZETTE OF INDIA VIDE G.S.R. 338 (E) DATED THE 23RD MARCH, 2016, INCLUDING THE COMPONENTS, CONSUMABLES, PARTS AND SPARES WHICH MAKE THESE PRODUCTS OPERATIONAL/=5%/=85
0/=FOLLOWING RENEWABLE ENERGY DEVICES & PARTS FOR THEIR MANUFACTURE (A) BIO-GAS PLANT (B) SOLAR POWER BASED DEVICES (C) SOLAR POWER GENERATING SYSTEM (D) WIND MILLS, WIND OPERATED ELECTRICITY GENERATOR (WOEG) (E) WASTE TO ENERGY PLANTS/DEVICES (F) SOLAR LANTERN/SOLAR LAMP (G) OCEAN WAVES/TIDAL WAVES ENERGY DEVICES/PLANTS/=5%/=85
0/=PARTS FOR MANUFACTURE OF TELEPHONES FOR CELLULAR NETWORKS OR FOR OTHER WIRELESS NETWORKS/=12%/=85
0/=PARTS SUITABLE FOR USE SOLELY OR PRINCIPALLY WITH POWER DRIVEN PUMPS PRIMARILY DESIGNED FOR HANDLING WATER, NAMELY, CENTRIFUGAL PUMPS( HORIZONTAL AND VERTICAL), DEEP TUBE-WELL TURBINE PUMPS, SUBMERSIBLE PUMPS, AXIAL FLOW AND MIXED FLOW VERTICAL PUMPS/=18%/=85
0/=RAILWAY OR TRAMWAY MAINTENANCE OR SERVICE VEHICLES, WHETHER OR NOT SELF-PROPELLED (FOR EXAMPLE, WORKSHOPS, CRANES, BALLAST TAMPERS, TRACKLINERS, TESTING COACHES AND TRACK INSPECTION VEHICLES)/=5%/=8604
0/=RAILWAY OR TRAMWAY PASSENGER COACHES, NOT SELF-PROPELLED; LUGGAGE VANS, POST OFFICE COACHES AND OTHER SPECIAL PURPOSE RAILWAY OR TRAMWAY COACHES, NOT SELF-PROPELLED (EXCLUDING THOSE OF HEADING 8604)/=5%/=8605
0/=CONTAINERS (INCLUDING CONTAINERS FOR THE TRANSPORT OF FLUIDS) SPECIALLY DESIGNED AND EQUIPPED FOR CARRIAGE BY ONE OR MORE MODES OF TRANSPORT [INCLUDING REFRIGERATED CONTAINERS]/=18%/=8609
0/=RAIL LOCOMOTIVES POWERED FROM AN EXTERNAL SOURCE OF ELECTRICITY OR BY ELECTRIC ACCUMULATORS/=5%/=8601
0/=OTHER RAIL LOCOMOTIVES; LOCOMOTIVE TENDERS; SUCH AS DIESEL-ELECTRIC LOCOMOTIVES, STEAM LOCOMOTIVES AND TENDERS THEREOF/=5%/=8602
0/=SELF-PROPELLED RAILWAY OR TRAMWAY COACHES, VANS AND TRUCKS, OTHER THAN THOSE OF HEADING 8604/=5%/=8603
0/=RAILWAY OR TRAMWAY GOODS VANS AND WAGONS, NOT SELF-PROPELLED/=5%/=8606
0/=PARTS OF RAILWAY OR TRAMWAY LOCOMOTIVES OR ROLLING-STOCK; SUCH AS BOGIES, BISSEL-BOGIES, AXLES AND WHEELS, AND PARTS THEREOF/=5%/=8607
0/=RAILWAY OR TRAMWAY TRACK FIXTURES AND FITTINGS; MECHANICAL (INCLUDING ELECTRO-MECHANICAL) SIGNALLING, SAFETY OR TRAFFIC CONTROL EQUIPMENT FOR RAILWAYS, TRAMWAYS, ROADS, INLAND WATERWAYS, PARKING FACILITIES, PORT INSTALLATIONS OR AIRFIELDS; PARTS OF THE FOREGOING/=5%/=8608
0/=FUEL CELL MOTOR VEHICLES/=12%/=87
0/=TANKS AND OTHER ARMOURED FIGHTING VEHICLES, MOTORISED, WHETHER OR NOT FITTED WITH WEAPONS, AND PARTS OF SUCH VEHICLES/=12%/=8710
0/=TRACTORS (EXCEPT ROAD TRACTORS FOR SEMI-TRAILERS OF ENGINE CAPACITY MORE THAN 1800 CC)/=12%/=8701
0/=ROAD TRACTORS FOR SEMI-TRAILERS OF ENGINE CAPACITY MORE THAN 1800 CC/=28%/=8701
0/=MOTOR VEHICLES FOR THE TRANSPORT OF TEN OR MORE PERSONS, INCLUDING THE DRIVER (EXCEPT 870210 ,870220, 870230, 870290 )/=28%/=8702
0/=OTHER OLD AND USED VEHICLES/=12%/=8703
0/=CARS FOR PHYSICALLY HANDICAPPED PERSONS, SUBJECT TO THE FOLLOWING CONDITIONS: A) AN OFFICER NOT BELOW THE RANK OF DEPUTY SECRETARY TO THE GOVERNMENT OF INDIA IN THE DEPARTMENT OF HEAVY INDUSTRIES CERTIFIES THAT THE SAID GOODS ARE CAPABLE OF BEING USED BY THE PHYSICALLY HANDICAPPED PERSONS; AND B) THE BUYER OF THE CAR GIVES AN AFFIDAVIT THAT HE SHALL NOT DISPOSE OF THE CAR FOR A PERIOD OF FIVE YEARS AFTER ITS PURCHASE./=18%/=8703
0/=OLD AND USED, PETROL LIQUEFIED PETROLEUM GASES (LPG) OR COMPRESSED NATURAL GAS (CNG) DRIVEN MOTOR VEHICLES OF ENGINE CAPACITY OF 1200 CC OR MORE AND OF LENGTH OF 4000 MM OR MORE. EXPLANATION. - FOR THE PURPOSES OF THIS ENTRY, THE SPECIFICATION OF THE MOTOR VEHICLE SHALL BE DETERMINED AS PER THE MOTOR VEHICLES ACT, 1988 (59 OF 1988) AND THE RULES MADE THERE UNDER./=18%/=8703
0/=OLD AND USED, DIESEL DRIVEN MOTOR VEHICLES OF ENGINE CAPACITY OF 1500 CC OR MORE AND OF LENGTH OF 4000 MM EXPLANATION. - FOR THE PURPOSES OF THIS ENTRY, THE SPECIFICATION OF THE MOTOR VEHICLE SHALL BE DETERMINED AS PER THE MOTOR VEHICLES ACT, 1988 (59 OF 1988) AND THE RULES MADE THERE UNDER./=18%/=8703
0/=OLD AND USED MOTOR VEHICLES OF ENGINE CAPACITY EXCEEDING 1500 CC, POPULARLY KNOWN AS SPORTS UTILITY VEHICLES (SUVS) INCLUDING UTILITY VEHICLES. EXPLANATION. - FOR THE PURPOSES OF THIS ENTRY, SUV INCLUDES A MOTOR VEHICLE OF LENGTH EXCEEDING 4000 MM AND HAVING GROUND CLEARANCE OF 170 MM. AND ABOVE./=18%/=8703
0/=HYDROGEN VEHICLES BASED ON FUEL CELL TECH AND OF LENGTH NOT EXCEEDING 4000 MM. EXPLANATION.FOR THE PURPOSES OF THIS ENTRY, THE SPECIFICATION OF THE MOTOR VEHICLE SHALL BE DETERMINED AS PER THE MOTOR VEHICLES ACT, 1988 (59 OF 1988) AND THE RULES MADE THERE UNDER./=28%/=8703
15/=MOTOR CARS AND OTHER MOTOR VEHICLES PRINCIPALLY DESIGNED FOR THE TRANSPORT OF PERSONS (OTHER THAN THOSE OF HEADING 8702), INCLUDING STATION WAGONS AND RACING CARS [OTHER THAN CARS FOR PHYSICALLY HANDICAPPED PERSONS ,OTHER THAN THOSE MENTIONED AT S. NOS. 1308 TO 1320 ABOVE/=28%/=8703
0/=MOTOR VEHICLES CLEARED AS AMBULANCES DULY FITTED WITH ALL THE FITMENTS, FURNITURE AND ACCESSORIES NECESSARY FOR AN AMBULANCE FROM THE FACTORY MANUFACTURING SUCH MOTOR VEHICLES/=28%/=8703
0/=THREE WHEELED VEHICLES/=28%/=8703
0/=OLD AND USED, PETROL LIQUEFIED PETROLEUM GASES (LPG) OR COMPRESSED NATURAL GAS (CNG) DRIVEN MOTOR VEHICLES OF ENGINE CAPACITY OF 1200 CC OR MORE AND OF LENGTH OF 4000 MM OR MORE. EXPLANATION. - FOR THE PURPOSES OF THIS ENTRY, THE SPECIFICATION OF THE MOTOR VEHICLE SHALL BE DETERMINED AS PER THE MOTOR VEHICLES ACT, 1988 (59 OF 1988) AND THE RULES MADE THERE UNDER./=18%/=8703
0/=OLD AND USED, DIESEL DRIVEN MOTOR VEHICLES OF ENGINE CAPACITY OF 1500 CC OR MORE AND OF LENGTH OF 4000 MM EXPLANATION. - FOR THE PURPOSES OF THIS ENTRY, THE SPECIFICATION OF THE MOTOR VEHICLE SHALL BE DETERMINED AS PER THE MOTOR VEHICLES ACT, 1988 (59 OF 1988) AND THE RULES MADE THERE UNDER./=18%/=8703
0/=OLD AND USED MOTOR VEHICLES OF ENGINE CAPACITY EXCEEDING 1500 CC, POPULARLY KNOWN AS SPORTS UTILITY VEHICLES (SUVS) INCLUDING UTILITY VEHICLES. EXPLANATION. - FOR THE PURPOSES OF THIS ENTRY, SUV INCLUDES A MOTOR VEHICLE OF LENGTH EXCEEDING 4000 MM AND HAVING GROUND CLEARANCE OF 170 MM. AND ABOVE./=18%/=8703
0/=OTHER OLD AND USED VEHICLES/=12%/=8703
0/=REFRIGERATED MOTOR VEHICLES/=18%/=8704
0/=MOTOR VEHICLES FOR THE TRANSPORT OF GOODS [OTHER THAN REFRIGERATED MOTOR VEHICLES]/=28%/=8704
0/=SPECIAL PURPOSE MOTOR VEHICLES, OTHER THAN THOSE PRINCIPALLY DESIGNED FOR THE TRANSPORT OF PERSONS OR GOODS (FOR EXAMPLE, BREAKDOWN LORRIES, CRANE LORRIES, FIRE FIGHTING VEHICLES, CONCRETE-MIXER LORRIES, ROAD SWEEPER LORRIES, SPRAYING LORRIES, MOBILE WORKSHOPS, MOBILE RADIOLOGICAL UNIT)/=18%/=8705
0/=CHASSIS FITTED WITH ENGINES, FOR THE MOTOR VEHICLES OF HEADINGS 8701 TO 8705/=28%/=8706
0/=BODIES (INCLUDING CABS), FOR THE MOTOR VEHICLES OF HEADINGS 8701 TO 8705/=28%/=8707
0/=FOLLOWING PARTS OF TRACTORS NAMELY: A. REAR TRACTOR WHEEL RIM, B. TRACTOR CENTRE HOUSING, C. TRACTOR HOUSING TRANSMISSION, D. TRACTOR SUPPORT FRONT AXLE/=18%/=8708
0/=PARTS AND ACCESSORIES OF THE MOTOR VEHICLES OF HEADINGS 8701 TO 8705 [OTHER THAN SPECIFIED PARTS OF TRACTORS]/=28%/=8708
0/=WORKS TRUCKS, SELF-PROPELLED, NOT FITTED WITH LIFTING OR HANDLING EQUIPMENT, OF THE TYPE USED IN FACTORIES, WAREHOUSES, DOCK AREAS OR AIRPORTS FOR SHORT DISTANCE TRANSPORT OF GOODS; TRACTORS OF THE TYPE USED ON RAILWAY STATION PLATFORMS; PARTS OF THE FOREGOING VEHICLES/=18%/=8709
0/=MOTORCYCLES (INCLUDING MOPEDS) AND CYCLES FITTED WITH AN AUXILIARY MOTOR, WITH OR WITHOUT SIDE-CARS; SIDE-CARS (ENGINE CAPACITY NOT EXCEEDING 350CC)/=28%/=8711
3/=MOTORCYCLES OF ENGINE CAPACITY EXCEEDING 350 CC./=28%/=8711
0/=BICYCLES AND OTHER CYCLES (INCLUDING DELIVERY TRICYCLES), NOT MOTORISED/=12%/=8712
0/=CARRIAGES FOR DISABLED PERSONS, WHETHER OR NOT MOTORISED OR OTHERWISE MECHANICALLY PROPELLED/=5%/=8713
0/=PARTS AND ACCESSORIES OF BICYCLES AND OTHER CYCLES (INCLUDING DELIVERY TRICYCLES), NOT MOTORISED, OF 8712/=12%/=8714
0/=PARTS AND ACCESSORIES OF VEHICLES OF HEADINGS 8711 AND 8713/=18%/=8714
0/=BABY CARRIAGES AND PARTS THEREOF/=18%/=8715
0/=TRAILERS AND SEMI-TRAILERS; OTHER VEHICLES, NOT MECHANICALLY PROPELLED; PARTS THEREOF [OTHER THAN SELF-LOADING OR SELF-UNLOADING TRAILERS FOR AGRICULTURAL PURPOSES, AND HAND PROPELLED VEHICLES (E.G. HAND CARTS, RICKSHAWS AND THE LIKE); ANIMAL DRAWN VEHICLES]/=18%/=8716
0/=SELF-LOADING OR SELF-UNLOADING TRAILERS FOR AGRICULTURAL PURPOSES/=12%/=8716
0/=HYDRAULIC AND ITS PARTS THEREOF FOR TRACTOR/=18%/=8708
0/=FENDER, HOOD, WRAPPER, GRILLS, SIDE PANEL, EXTENSION PLATES, FUEL TANK AND PARTS THEREOF FOR TRACTORS/=18%/=8708
0/=STEERING WHEELS AND ITS PARTS THEREOF FOR TRACTOR/=18%/=8708
0/=CLUTCH ASSEMBLY AND ITS PARTS THEREOF FOR TRACTORS/=18%/=8708
0/=SILENCER ASSEMBLY FOR TRACTORS AND ARTS THEREOF/=18%/=8708
0/=(I) RADIATOR ASSEMBLY FOR TRACTORS AND PARTS THEREOF(II) COOLING SYSTEM FOR TRACTOR ENGINE AND PARTS THEREOF/=18%/=8708
0/=ROAD WHEELS AND PARTS AND ACCESSORIES THEREOF FOR TRACTORS/=18%/=8708
0/=TRANSAXLES AND ITS PARTS THEREOF FOR TRACTORS/=18%/=8708
0/=GEAR BOXES AND PARTS THEREOF FOR TRACTORS/=18%/=8708
0/=BRAKES ASSEMBLY AND ITS PARTS THEREOF FOR TRACTORS/=18%/=8708
0/=BUMPERS AND PARTS THEREOF FOR TRACTORS/=18%/=8708
0/=ELECTRICALLY OPERATED VEHICLES, INCLUDING THREE WHEELED ELECTRIC MOTOR VEHICLES./=28%/=8703
0/=HAND PROPELLED VEHICLES (E.G. HAND CARTS, RICKSHAWS AND THE LIKE); ANIMAL DRAWN VEHICLES/=12%/=8716
0/=ELECTRICALLY OPERATED VEHICLES, INCLUDING THREE WHEELED ELECTRIC MOTOR VEHICLES./=28%/=8703
0/=FOLLOWING VEHICLES, WITH BOTH COMPRESSION -IGNITION INTERNAL COMBUSTION PISTON ENGINE [ DIESEL-OR SEMI DIESEL ) AND ELECTRIC MOTOR AS MOTORS FOR PROPULSION; A) MOTOR VEHICLES CLEARED AS AMBULANCES DULY FITTED WITH ALL THE FITMENTS, FURNITURE AND ACCESSORIES NECESSARY FOR AN AMBULANCE FROM THE FACTORY MANUFACTURING SUCH MOTOR VEHICLES B) THREE WHEELED VEHICLES C) MOTOR VEHICLES OF ENGINE CAPACITY NOT EXCEEDING 1500 CC AND OF LENGTH NOT EXCEEDING 4000 MM. EXPLANATION.FOR THE PURPOSES OF THIS ENTRY, THE SPECIFICATION OF THE MOTOR VEHICLE SHALL BE DETERMINED AS PER THE MOTOR VEHICLES ACT, 1988 (59 OF 1988) AND THE RULES MADE THERE UNDER./=28%/=8703
0/=FOLLOWING VEHICLES, WITH BOTH COMPRESSION -IGNITION INTERNAL COMBUSTION PISTON ENGINE [ DIESEL-OR SEMI DIESEL ) AND ELECTRIC MOTOR AS MOTORS FOR PROPULSION; A) MOTOR VEHICLES CLEARED AS AMBULANCES DULY FITTED WITH ALL THE FITMENTS, FURNITURE AND ACCESSORIES NECESSARY FOR AN AMBULANCE FROM THE FACTORY MANUFACTURING SUCH MOTOR VEHICLES B) THREE WHEELED VEHICLES C) MOTOR VEHICLES OF ENGINE CAPACITY NOT EXCEEDING 1500 CC AND OF LENGTH NOT EXCEEDING 4000 MM. EXPLANATION.FOR THE PURPOSES OF THIS ENTRY, THE SPECIFICATION OF THE MOTOR VEHICLE SHALL BE DETERMINED AS PER THE MOTOR VEHICLES ACT, 1988 (59 OF 1988) AND THE RULES MADE THERE UNDER./=28%/=8703
0/=FOLLOWING VEHICLES, WITH BOTH SPARK-IGNITION INTERNAL COMBUSTION RECIPROCATING PISTON ENGINE AND ELECTRIC MOTOR AS MOTORS FOR PROPULSION; A) MOTOR VEHICLES CLEARED AS AMBULANCES DULY FITTED WITH ALL THE FITMENTS, FURNITURE AND ACCESSORIES NECESSARY FOR AN AMBULANCE FROM THE FACTORY MANUFACTURING SUCH MOTOR VEHICLES B) THREE WHEELED VEHICLES C) MOTOR VEHICLES OF ENGINE CAPACITY NOT EXCEEDING 1200CC AND OF LENGTH NOT EXCEEDING 4000 MM. EXPLANATION.FOR THE PURPOSES OF THIS ENTRY, THE SPECIFICATION OF THE MOTOR VEHICLE SHALL BE DETERMINED AS PER THE MOTOR VEHICLES ACT, 1988 (59 OF 1988) AND THE RULES MADE THERE UNDER./=28%/=8703
0/=FOLLOWING VEHICLES, WITH BOTH SPARK-IGNITION INTERNAL COMBUSTION RECIPROCATING PISTON ENGINE AND ELECTRIC MOTOR AS MOTORS FOR PROPULSION; A) MOTOR VEHICLES CLEARED AS AMBULANCES DULY FITTED WITH ALL THE FITMENTS, FURNITURE AND ACCESSORIES NECESSARY FOR AN AMBULANCE FROM THE FACTORY MANUFACTURING SUCH MOTOR VEHICLES B) THREE WHEELED VEHICLES C) MOTOR VEHICLES OF ENGINE CAPACITY NOT EXCEEDING 1200CC AND OF LENGTH NOT EXCEEDING 4000 MM. EXPLANATION.FOR THE PURPOSES OF THIS ENTRY, THE SPECIFICATION OF THE MOTOR VEHICLE SHALL BE DETERMINED AS PER THE MOTOR VEHICLES ACT, 1988 (59 OF 1988) AND THE RULES MADE THERE UNDER./=28%/=8703
3/=DIESEL DRIVEN MOTOR VEHICLES OF ENGINE CAPACITY NOT EXCEEDING 1500 CC AND OF LENGTH NOT EXCEEDING 4000 MM. EXPLANATION.FOR THE PURPOSES OF THIS ENTRY, THE SPECIFICATION OF THE MOTOR VEHICLE SHALL BE DETERMINED AS PER THE MOTOR VEHICLES ACT, 1988 (59 OF 1988) AND THE RULES MADE THERE UNDER./=28%/=8703
1/=PETROL, LIQUEFIED PETROLEUM GASES (LPG) OR COMPRESSED NATURAL GAS (CNG) DRIVEN MOTOR VEHICLES OF ENGINE CAPACITY NOT EXCEEDING 1200CC AND OF LENGTH NOT EXCEEDING 4000 MM. EXPLANATION.FOR THE PURPOSES OF THIS ENTRY, THE SPECIFICATION OF THE MOTOR VEHICLE SHALL BE DETERMINED AS PER THE MOTOR VEHICLES ACT, 1988 (59 OF 1988) AND THE RULES MADE THERE UNDER./=28%/=8703
1/=PETROL, LIQUEFIED PETROLEUM GASES (LPG) OR COMPRESSED NATURAL GAS (CNG) DRIVEN MOTOR VEHICLES OF ENGINE CAPACITY NOT EXCEEDING 1200CC AND OF LENGTH NOT EXCEEDING 4000 MM. EXPLANATION.FOR THE PURPOSES OF THIS ENTRY, THE SPECIFICATION OF THE MOTOR VEHICLE SHALL BE DETERMINED AS PER THE MOTOR VEHICLES ACT, 1988 (59 OF 1988) AND THE RULES MADE THERE UNDER./=28%/=8703
16/=MOTOR VEHICLES FOR THE TRANSPORT OF 10 OR MORE PERSONS BUT NOT MORE THAN 13, INCLUDING THE DRIVER/=28%/=8702
16/=MOTOR VEHICLES FOR THE TRANSPORT OF 10 OR MORE PERSONS BUT NOT MORE THAN 13, INCLUDING THE DRIVER/=28%/=8702
16/=MOTOR VEHICLES FOR THE TRANSPORT OF 10 OR MORE PERSONS BUT NOT MORE THAN 13, INCLUDING THE DRIVER/=28%/=8702
16/=MOTOR VEHICLES FOR THE TRANSPORT OF 10 OR MORE PERSONS BUT NOT MORE THAN 13, INCLUDING THE DRIVER/=28%/=8702
0/=ELECTRICALLY OPERATED VEHICLES, INCLUDING TWO AND THREE WHEELED ELECTRIC MOTOR VEHICLES/=12%/=87
0/=BALLOONS AND DIRIGIBLES, GLIDERS AND OTHER NON-POWERED AIRCRAFT/=18%/=8801
0/=OTHER AIRCRAFT (FOR EXAMPLE, HELICOPTERS, AEROPLANES), OTHER THAN THOSE FOR PERSONAL USE./=5%/=8802
3/=AIRCRAFTS FOR PERSONAL USE/=28%/=8802
0/=PARTS OF GOODS OF HEADING 8801/=0%/=8803
0/=PARTS OF GOODS OF HEADING 8802/=5%/=8803
0/=PARACHUTES (INCLUDING DIRIGIBLE PARACHUTES AND PARAGLIDERS) AND ROTOCHUTES; PARTS THEREOF AND ACCESSORIES THERETO AND PARTS THEREOF/=18%/=8804
0/=AIRCRAFT LAUNCHING GEAR, DECK ARRESTOR OR SIMILAR GEAR; GROUND FLYING TRAINERS AND PARTS THEREOF/=18%/=8805
0/=SPACECRAFT (INCLUDING SATELLITES) AND SUBORBITAL AND SPACECRAFT LAUNCH VEHICLES/=0%/=8802
0/=TUGS AND PUSHER CRAFT/=5%/=8904
0/=CRUISE SHIPS, EXCURSION BOATS, FERYBOATS, CARGO SHIPS, BARGES AND SIMILAR VESSELS FOR THE TRANSPORT OF PERSONS OR GOODS/=5%/=8901
0/=FISHING VESSELS; FACTORY SHIPS AND OTHER VESSELS FOR PROCESSING OR PRESERVING FISHERY PRODUCTS/=5%/=8902
3/=YACHTS AND OTHER VESSELS FOR PLEASURE OR SPORTS; ROWING BOATS AND CANOES/=28%/=8903
0/=LIGHT-VESSELS, FIRE-FLOATS, DREDGERS, FLOATING CRANES AND OTHER VESSELS THE NAVIGABILITY OF WHICH IS SUBSIDIARY TO THEIR MAIN FUNCTION; FLOATING DOCKS; FLOATING OR SUBMERSIBLE DRILLING OR PRODUCTION PLATFORMS/=5%/=8905
0/=OTHER VESSELS, INCLUDING WARSHIPS AND LIFEBOATS OTHER THAN ROWING BOATS/=5%/=8906
0/=OTHER FLOATING STRUCTURES (FOR EXAMPLE, RAFTS, TANKS, COFFER-DAMS, LANDINGSTAGES, BUOYS AND BEACONS)/=5%/=8907
0/=VESSELS AND OTHER FLOATING STRUCTURES FOR BREAKING UP/=18%/=8908
0/=OTHER BREATHING APPLIANCES AND GAS MASKS, EXCLUDING PROTECTIVE MASKS HAVING NEITHER MECHANICAL PARTS NOR REPLACEABLE FILTERS/=12%/=9020
0/=PARTS AND ACCESSORIES (NOT SPECIFIED OR INCLUDED ELSEWHERE IN THIS CHAPTER) FOR MACHINES, APPLIANCES, INSTRUMENTS OR APPARATUS OF CHAPTER 90/=18%/=9033
0/=CONTACT LENSES; SPECTACLE LENSES/=12%/=9001
0/=OPTICAL FIBRES AND OPTICAL FIBRE BUNDLES; OPTICAL FIBRE CABLES OTHER THAN THOSE OF HEADING 8544; SHEETS AND PLATES OF POLARISING MATERIAL; PRISMS, MIRRORS AND OTHER OPTICAL ELEMENTS, OF ANY MATERIAL, UNMOUNTED, OTHER THAN SUCH ELEMENTS OF GLASS NOT OPTICALLY WORKED/=18%/=9001
0/=INTRAOCULAR LENS/=12%/=9002
0/=LENSES, PRISMS, MIRRORS AND OTHER OPTICAL ELEMENTS, OF ANY MATERIAL, MOUNTED, BEING PARTS OF OR FITTINGS FOR INSTRUMENTS OR APPARATUS, OTHER THAN SUCH ELEMENTS OF GLASS NOT OPTICALLY WORKED [OTHER THAN INTRAOCULAR LENS]/=18%/=9002
0/=FRAMES AND MOUNTINGS FOR SPECTACLES, GOGGLES OR THE LIKE, AND PARTS THEREOF/=12%/=9003
0/=SPECTACLES, CORRECTIVE (INSERTED W.E.F : 14/11/2017 : [OTHER THAN GOGGLES FOR CORRECTING VISION]/=12%/=9004
0/=SPECTACLES [OTHER THAN CORRECTIVE]; GOGGLES (INSERTED W.E.F : 14/11/2017 INCLUDING THOSE FOR CORRECTING VISION)/=18%/=9004
0/=BINOCULARS, MONOCULARS, OTHER OPTICAL TELESCOPES, AND MOUNTINGS THEREFOR; OTHER ASTRONOMICAL INSTRUMENTS AND MOUNTINGS THEREFOR, BUT NOT INCLUDING INSTRUMENTS FOR RADIO-ASTRONOMY/=18%/=9005
0/=PHOTOGRAPHIC (OTHER THAN CINEMATOGRAPHIC) CAMERAS; PHOTOGRAPHIC FLASHLIGHT APPARATUS AND FLASHBULBS OTHER THAN DISCHARGE LAMPS OF HEADING 8539/=18%/=9006
0/=CINEMATOGRAPHIC CAMERAS AND PROJECTORS, WHETHER OR NOT INCORPORATING SOUND RECORDING OR REPRODUCING APPARATUS/=18%/=9007
0/=IMAGE PROJECTORS, OTHER THAN CINEMATOGRAPHIC; PHOTOGRAPHIC (OTHER THAN CINEMATOGRAPHIC) ENLARGERS AND REDUCERS/=18%/=9008
0/=APPARATUS AND EQUIPMENT FOR PHOTOGRAPHIC (INCLUDING CINEMATOGRAPHIC) LABORATORIES, NOT SPECIFIED OR INCLUDED ELSEWHERE IN THIS CHAPTER; NEGATOSCOPES; PROJECTION SCREENS/=18%/=9010
0/=COMPOUND OPTICAL MICROSCOPES, INCLUDING THOSE FOR PHOTOMICROGRAPHY CINEPHOTOMICROGRAPHY OR MICROPROJECTION/=18%/=9011
0/=MICROSCOPES OTHER THAN OPTICAL MICRO- SCOPES; DIFFRACTION APPARATUS/=18%/=9012
0/=LIQUID CRYSTAL DEVICES NOT CONSTITUTING ARTICLES PROVIDED FOR MORE SPECIFICALLY IN OTHER HEADINGS; LASERS, OTHER THAN LASER DIODES; OTHER OPTICAL APPLIANCES AND INSTRUMENTS, NOT SPECIFIED OR INCLUDED ELSEWHERE IN THIS CHAPTER/=18%/=9013
0/=DIRECTION FINDING COMPASSES; OTHER NAVIGATIONAL INSTRUMENTS AND APPLIANCES/=18%/=9014
0/=SURVEYING (INCLUDING PHOTOGRAMMETRICAL SURVEYING), HYDROGRAPHIC, OCEANOGRAPHIC, HYDROLOGICAL, METEOROLOGICAL OR GEOPHYSICAL INSTRUMENTS AND APPLIANCES, EXCLUDING COMPASSES; RANGEFINDERS/=18%/=9015
0/=BALANCES OF A SENSITIVITY OF 5 CG OR BETTER, WITH OR WITHOUT WEIGHTS [DELETED W.E.F 14/11/2017 :OTHER THAN ELECTRIC OR ELECTRONIC BALANCES]/=18%/=9016
0/=ELECTRIC OR ELECTRONIC BALANCES OF A SENSITIVITY OF 5 CG OR BETTER, WITH OR WITHOUT WEIGHTS/=18%/=9016
0/=INSTRUMENTS FOR MEASURING LENGTH, FOR USE IN THE HAND (FOR EXAMPLE, MEASURING RODS AND TAPES, MICROMETERS, CALLIPERS), NOT SPECIFIED OR INCLUDED ELSEWHERE IN THE CHAPTER/=18%/=9017
0/=INSTRUMENTS AND APPLIANCES USED IN MEDICAL, SURGICAL, DENTAL OR VETERINARY SCIENCES, INCLUDING SCINTIGRAPHIC APPARATUS, OTHER ELECTRO-MEDICAL APPARATUS AND SIGHT-TESTING INSTRUMENTS/=12%/=9018
0/=MECHANO-THERAPY APPLIANCES; MASSAGE APPARATUS; PSYCHOLOGICAL APTITUDE TESTING APPARATUS; OZONE THERAPY, OXYGEN THERAPY, AEROSOL THERAPY, ARTIFICIAL RESPIRATION OR OTHER THERAPEUTIC RESPIRATION APPARATUS/=12%/=9019
0/=HEARING AIDS/=0%/=9021
0/=(INSERTED W.E.F 14/11/2017 :SPLINTS AND OTHER FRACTURE APPLIANCES; ARTIFICIAL PARTS OF THE BODY; OTHER APPLIANCES WHICH ARE WORN OR CARRIED, OR IMPLANTED IN THE BODY, TO COMPENSATE FOR A DEFECT OR DISABILITY; INTRAOCULAR LENS.) ORTHOPAEDIC APPLIANCES, INCLUDING CRUTCHES, SURGICAL BELTS AND TRUSSES : DELETED W.E.F 14/11/2017/=12%/=9021
0/=APPARATUS BASED ON THE USE OF X-RAYS OR OF ALPHA, BETA OR GAMMA RADI-ATIONS, FOR MEDICAL, SURGICAL, DENTAL OR VETERINARY USES, INCLUDING RADI-OGRAPHY OR RADIOTHERAPY APPARATUS, X-RAY TUBES AND OTHER X-RAY GEN-ERATORS, HIGH TENSION GENERATORS, CONTROL PANELS AND DESKS, SCREENS, EX-AMINATIONS OR TREATMENT TABLES, CHAIRS AND THE LIGHT/=18%/=9022
0/=APPARATUS BASED ON THE USE OF X-RAYS OR OF ALPHA, BETA OR GAMMA RADIATIONS, FOR INCLUDING RADIOGRAPHY OR RADIOTHERAPY APPARATUS, X-RAY TUBES AND OTHER X-RAY GENERATORS, HIGH TENSION GENERA- TORS, CONTROL PANELS AND DESKS, SCREENS, EXAMINATIONS OR TREATMENT TABLES, CHAIRS AND THE LIGHT/=18%/=9022
0/=INSTRUMENTS, APPARATUS AND MODELS, DESIGNED FOR DEMONSTRATIONAL PURPOSES (FOR EXAMPLE, IN EDUCATION OR EXHIBITIONS), UNSUITABLE FOR OTHER USES/=18%/=9023
0/=MACHINES AND APPLIANCES FOR TESTING THE HARDNESS, STRENGTH, COMPRESSIBILITY, ELASTICITY OR OTHER MECHANICAL PROPERTIES OF MATERIALS (FOR EXAMPLE, METALS, WOOD, TEXTILES, PAPER, PLASTICS)/=18%/=9024
0/=HYDROMETERS AND SIMILAR FLOATING INSTRUMENTS, THERMOMETERS, PYROMETERS, BAROMETERS, HYGROMETERS AND PSYCHROMETERS, RECORDING OR NOT, AND ANY COMBINATION OF THESE INSTRUMENTS/=18%/=9025
0/=INSTRUMENTS AND APPARATUS FOR MEASURING OR CHECKING THE FLOW, LEVEL, PRESSURE OR OTHER VARIABLES OF LIQUIDS OR GASES (FOR EXAMPLE, FLOW METERS, LEVEL GAUGES, MANOMETERS, HEAT METERS), EXCLUDING INSTRUMENTS AND APPARATUS OF HEADING 9014, 9015, 9028 OR 9032/=18%/=9026
0/=INSTRUMENTS AND APPARATUS FOR PHYSICAL OR CHEMICAL ANALYSIS (FOR EXAMPLE, POLARIMETERS, REFRACTOMETERS, SPECTROMETERS, GAS OR SMOKE ANALYSIS APPARATUS); INSTRUMENTS AND APPARATUS FOR MEASURING OR CHECKING VISCOSITY, POROSITY, EXPANSION, SURFACE TENSION OR THE LIKE; INSTRUMENTS AND APPRATUS FOR MEASURING OR CHECKING QUANTITIES OF HEAT, SOUND OR LIGHT (INCLUDING EXPOSURE METERS); MICROTOMES/=18%/=9027
0/=GAS, LIQUID OR ELECTRICITY SUPPLY OR PRODUCTION METERS, INCLUDING CALIBRATING METERS THEREFOR/=18%/=9028
0/=REVOLUTION COUNTERS, PRODUCTION COUNTERS, TAXIMETERS, MILEOMETERS, PEDOMETERS AND THE LIKE; SPEED INDICATORS AND TACHOMETERS, OTHER THAN THOSE OF HEADING 9014 OR 9015; STROBOSCOPES/=18%/=9029
0/=OSCILLOSCOPES, SPECTRUM ANALYSERS AND OTHER INSTRUMENTS AND APPARATUS FOR MEASURING OR CHECKING ELECTRICAL QUANTITIES, EXCLUDING METERS OF HEADING 90.28; INSTRUMENTS AND APPARATUS FOR MEASURING OR DETECTING ALPHA, BETA, GAMMA, X-RAY, COSMIC OR OTHER IONISING RADIATIONS/=18%/=9030
0/=MEASURING OR CHECKING INSTRUMENTS, APPLIANCES AND MACHINES, NOT SPECIFIED OR INCLUDED ELSEWHERE IN THIS CHAPTER; PROFILE PROJECTORS/=18%/=9031
0/=AUTOMATIC REGULATING OR CONTROLLING INSTRUMENTS AND APPARATUS/=18%/=9032
0/=DRAWING AND MARKING OUT INSTRUMENTS; MATHEMATICAL CALCULATING IN-STRUMENTS; PANTOGRAPHS; OTHER DRAWING OR MARKING OUT INSTRUMENTS/=12%/=9017
0/=CORONARY STENTS AND CORONARY STENT SYSTEMS FOR USE WITH CARDIAC CATHETERS/=5%/=90
0/=DISPOSABLE STERILIZED DIALYZER OR MICRO BARRIER OF ARTIFICIAL KIDNEY/=5%/=90
0/=INSTRUMENT PANEL CLOCKS AND CLOCKS OF A SIMILAR TYPE FOR VEHICLES, AIRCRAFT, SPACECRAFT OR VESSELS/=18%/=9104
0/=TIME SWITCHES WITH CLOCK OR WATCH MOVEMENT OR WITH SYNCHRONOUS MOTOR/=18%/=9107
0/=WRIST-WATCHES, POCKET-WATCHES AND OTHER WATCHES, INCLUDING STOPWATCHES, WITH CASE OF PRECIOUS METAL OR OF METAL CLAD WITH PRECIOUS METAL/=18%/=9101
0/=WRIST-WATCHES, POCKET-WATCHES AND OTHER WATCHES, INCLUDING STOP WATCHES, OTHER THAN THOSE OF HEADING 9101/=18%/=9102
0/=CLOCKS WITH WATCH MOVEMENTS, EXCLUDING CLOCKS OF HEADING 9104/=18%/=9103
0/=OTHER CLOCKS/=18%/=9105
0/=TIME OF DAY RECORDING APPARATUS AND APPARATUS FOR MEASURING, RECORDING OR OTHERWISE INDICATING INTERVALS OF TIME, WITH CLOCK OR WATCH MOVEMENT OR WITH SYNCHRONOUS MOTOR (FOR EXAMPLE, TIME REGISTERS, TIME-RECORDERS)/=18%/=9106
0/=WATCH MOVEMENTS, COMPLETE AND ASSEMBLED/=18%/=9108
0/=CLOCK MOVEMENTS, COMPLETE AND ASSEMBLED/=18%/=9109
0/=COMPLETE CLOCK MOVEMENTS, UNASSEMBLED OR PARTLY ASSEMBLED (MOVEMENT SETS); INCOMPLETE (INSERTED W.E.F 14/11/2017 : WATCH ) OR CLOCK MOVEMENTS, ASSEMBLED; ROUGH (INSERTED W.E.F : 14/11/2017 WATCH) OR CLOCK MOVEMENTS/=18%/=9110
0/=COMPLETE WATCH MOVEMENTS, UNASSEMBLED OR PARTLY ASSEMBLED (MOVEMENT SETS); INCOMPLETE WATCH MOVEMENTS, ASSEMBLED; ROUGH/=18%/=9110
0/=WATCH CASES AND PARTS THEREOF/=18%/=9111
0/=CLOCK CASES, (DELETED W.E.F : 14/11/2017 :AND PARTS THEREOF) [INSERTED W.E.F 14/11/2017 : AND CASES OF A SIMILAR TYPE FOR OTHER GOODS OF THIS CHAPTER, AND PARTS THEREOF]/=18%/=9112
0/=CASES FOR OTHER THAN CLOCKS, AND PARTS THEREOF/=28%/=9112
0/=WATCH STRAPS, WATCH BANDS AND WATCH BRACELETS, AND PARTS THEREOF/=18%/=9113
0/=OTHER CLOCK PARTS/=18%/=9114
0/=OTHER WATCH PARTS/=18%/=9114
0/=PIANOS, INCLUDING AUTOMATIC PIANOS; HARPSI-CHORDS AND OTHER KEYBOARD STRINGED INSTRUMENTS/=18%/=9201
0/=OTHER STRING MUSICAL INSTRUMENTS (FOR EXAMPLE, GUITARS, VIOLINS, HARPS)/=18%/=9202
0/=WIND MUSICAL INSTRUMENTS (FOR EXAMPLE, KEYBOARD PIPE ORGANS, ACCORDIONS, CLARINETS, TRUMPETS, BAGPIPES), OTHER THAN FAIRGROUND ORGANS AND MECHANICAL STREET ORGANS/=18%/=9205
0/=MUSICAL INSTRUMENTS, THE SOUND OF WHICH IS PRODUCED, OR MUST BE AMPLIFIED, ELECTRICALLY (FOR EXAMPLE, ORGANS, GUITARS, ACCORDIONS)/=18%/=9207
0/=MUSICAL BOXES, FAIRGROUND ORGANS, MECHANICAL STREET ORGANS, MECHANICAL SINGING BIRDS, MUSICAL SAWS AND OTHER MUSICAL INSTRUMENTS NOT FALLING WITHIN ANY OTHER HEADING OF THIS CHAPTER; DECOY CALLS OF ALL KINDS; WHISTLES, CALL HORNS AND OTHER MOUTH-BLOWN SOUND SIGNALING INSTRUMENTS/=18%/=9208
0/=PARTS (FOR EXAMPLE, MECHANISMS FOR MUSICAL BOXES) AND ACCESSORIES (FOR EXAMPLE, CARDS, DISCS AND ROLLS FOR MECHANICAL INSTRUMENTS) OF MUSICAL INSTRUMENTS; METRONOMES, TUNING FORKS AND PITCH PIPES OF ALL KINDS/=18%/=9209
0/=PERCUSSION MUSICAL INSTRUMENTS (FOR EXAMPLE, DRUMS, XYLOPHONES, CYMBOLS, CASTANETS, MARACAS)/=18%/=9206
0/=INDIGENOUS HANDMADE MUSICAL INSTRUMENTS/=0%/=92
0/=REVOLVERS AND PISTOLS, OTHER THAN THOSE OF HEADING 9303 OR 9304/=28%/=9302
0/=OTHER ARMS (FOR EXAMPLE, SPRING, AIR OR GAS GUNS AND PISTOLS, TRUNCHEONS), EXCLUDING THOSE OF HEADING 9307/=18%/=9304
0/=SWORDS, CUT LASSES, BAYONETS, LANCES AND SIMILAR ARMS AND PARTS THEREOF AND SCABBARDS AND SHEATHS THEREFOR/=18%/=9307
0/=MILITARY WEAPONS OTHER THAN REVOLVERS, PISTOLS/=18%/=9301
